{
  "food_name": "Big Mac",
  "serving_unit": "burger",
  "nix_brand_id": "513fbc1283aa2dc80c000053",
  "brand_name_item_name": "McDonald's Big Mac",
  "serving_qty": 1,
  "nf_calories": 540,
  "photo": "value",
  "brand_name": "McDonald's",
  "region": 1,
  "brand_type": 1,
  "nix_item_id": "513fc9e73fe3ffd40300109f",
  "locale": "en_US"
}